task_id	strategy	run_id	round_id	commit	worker_declared_family	worker_declared_subfamily	controller_inferred_family	controller_inferred_subfamily	proposal_family	proposal_subfamily	family_consensus	parent_round_id	parent_commit	search_mode	dev_score	confirm_score	blind_score	confirm_checked	confirm_round_score	confirm_survival	delta_vs_best	delta_vs_parent	status	decision_reason	failure_type	failure_mode	training_seconds	lines_changed	novelty_level	description
neoantigen	constrained	1	98	33e0d3e											0.620469			0					discard				303.149964	9		Read `program.md` and `train.py`, then modified only `train.py`. Added a shared `binding_shift = mut_hla - wt_hla` and changed `binding_contrast_context` to consume `binding_shift` plus `abs(binding_shift)` instead of `average_peptide * hla` and `mut_hla * wt_hla`, keeping the edit focused on a higher-level HLA-conditioned WT-vs-Mut contrast representation. Reused `binding_shift` in the preference-contrast and main contrast inputs for consistency. Verification: `python -m py_compile train.py` passed.
neoantigen	constrained	1	99	51e5fa1											0.583937			0					discard				303.454441	14		Read `program.md` and `train.py`, then modified only `train.py`. Added a shared `binding_shift = mut_hla - wt_hla` with directional `relu` splits, reused that explicit HLA-conditioned WT-vs-Mut shift in the existing preference/contrast inputs, and widened `contrast_agreement_context` so the kept round-97 agreement bridge now reads signed plus directional peptide-HLA shift directly alongside the existing preference/scalar/binding hidden states. Verification: `python -m py_compile train.py` passed.
neoantigen	constrained	1	100	813fdc0											0.368839			0					discard				303.393756	50		Read `program.md` and `train.py`, then modified only `train.py`. Added `preference_binding_context`, a compact encoder over `preference_delta_hidden`, `binding_contrast_hidden`, their elementwise agreement, and signed plus absolute `binding_shift = mut_hla - wt_hla`. Routed that hidden state only into `preference_contrast_head`, and reused the shared `binding_shift` where the same WT-vs-Mut HLA-conditioned contrast signal was already consumed. Verification: `python -m py_compile train.py` passed.
hla_immunogenicity	constrained	1	3	764c349											0.886583			0					discard				304.436342	65		Modified [train.py](/Volumes/KINGSTON/work/research/AutoNeoAg/train.py#L361) to add `HLAConditionedScalarTower`, which projects comparison/context scalar features together with the HLA embedding and explicit scalar-HLA interactions. Wired that hidden state into the contrast head input and final fusion conditioning in [train.py](/Volumes/KINGSTON/work/research/AutoNeoAg/train.py#L445) and [train.py](/Volumes/KINGSTON/work/research/AutoNeoAg/train.py#L496). No loss, sampling, or output-bias tweaks were made. Verified with `python -m py_compile train.py`.
hla_immunogenicity	constrained	1	4	df0e95f											0.903190			0					keep				304.011942	75		Modified [train.py](/Volumes/KINGSTON/work/research/AutoNeoAg/train.py#L345) to replace the old scalar-only contrast conditioning with `HLAConditionedContrastScalars`, which projects comparison/context scalars together with the HLA embedding and their explicit interaction. Wired that hidden state into the contrast head input and final conditioning path in [train.py](/Volumes/KINGSTON/work/research/AutoNeoAg/train.py#L408) and [train.py](/Volumes/KINGSTON/work/research/AutoNeoAg/train.py#L456). Verified with `python -m py_compile train.py`.
hla_immunogenicity	constrained	1	5	f93d291											0.842347			0					discard				304.304358	66		Modified /Volumes/KINGSTON/work/research/AutoNeoAg/train.py at lines around 366-402 to add `HLAConditionedContrastBridge`, which projects preference-delta, HLA-conditioned contrast scalars, and HLA features into an explicit interaction block using difference and multiplicative terms. Wired that bridge into the model init around lines 458-476 and the forward path around lines 509-555 so the bridge output feeds both the contrast head and final conditioning stack alongside the existing scalar and contrast branches. Verified with `python -m py_compile train.py`.
hla_immunogenicity	constrained	1	6	67e20c7											0.926406			0					keep				304.201460	45		Modified `/Volumes/KINGSTON/work/research/AutoNeoAg/train.py` to add `ContrastAgreementBlock` around lines 366-389, which fuses `preference_delta_hidden` and the existing `contrast_scalar_hidden` using concat, absolute-difference, and elementwise-product terms. Wired that agreement state into the contrast head input and final conditioning path around lines 445-455 and 488-533. No loss, sampling, weighting, or output-bias changes were made. Verified with `python -m py_compile train.py`.
hla_immunogenicity	constrained	1	7	2cf3044											0.927981			0					keep				304.199784	68		Modified /Volumes/KINGSTON/work/research/AutoNeoAg/train.py to add `PreferenceContextBlock`, which fuses mutant preference hidden state, wildtype preference hidden state, and the existing HLA-conditioned contrast-scalar representation using average, absolute-difference, multiplicative, and scalar-interaction terms. Wired that hidden state into both the contrast head input and final conditioning path alongside the existing contrast-scalar and agreement branches. Verified with `python -m py_compile train.py`.
hla_immunogenicity	constrained	1	8	f2e1bff											0.930970			0					keep				304.173175	52		Modified `/Volumes/KINGSTON/work/research/AutoNeoAg/train.py` to add `HLAConditionedPairScalars` at [train.py](/Volumes/KINGSTON/work/research/AutoNeoAg/train.py#L425), which projects base scalar features together with the HLA embedding and the average WT/Mut preference state using explicit multiplicative interactions. Wired that hidden state into model construction and sizing at [train.py](/Volumes/KINGSTON/work/research/AutoNeoAg/train.py#L510) and into the forward path at [train.py](/Volumes/KINGSTON/work/research/AutoNeoAg/train.py#L565) so it feeds both the contrast head and final conditioning stack. Verified with `python -m py_compile train.py`.
hla_immunogenicity	constrained	1	9	9715d93											0.911837			0					discard				304.065879	53		Modified `/Volumes/KINGSTON/work/research/AutoNeoAg/train.py` to add `PreferencePairContextBlock` at line 457, which mixes `preference_delta_hidden`, `average_preference_hidden`, and the existing `pair_scalar_context_hidden` using concat, absolute-difference, and multiplicative terms. Wired that branch into model sizing and construction around lines 561-586, and into the forward path around lines 626-701 so it feeds both the contrast head and final conditioning stack alongside the existing contrast-scalar, agreement, preference-context, and pair-scalar branches. Verified with `python -m py_compile train.py`.
hla_immunogenicity	constrained	1	10	c573f74											0.855787			0					discard				304.234433	42		Modified `/Volumes/KINGSTON/work/research/AutoNeoAg/train.py` to add a new `pair_summary` feature block at [train.py](/Volumes/KINGSTON/work/research/AutoNeoAg/train.py#L39) and compute its mean-state / absolute-gap features in [train.py](/Volumes/KINGSTON/work/research/AutoNeoAg/train.py#L216). Updated the default scalar feature selection to include that block, and changed the existing HLA-conditioned pair-scalar path to consume `base + pair_summary` together in [train.py](/Volumes/KINGSTON/work/research/AutoNeoAg/train.py#L530) and [train.py](/Volumes/KINGSTON/work/research/AutoNeoAg/train.py#L588). Verified with `python -m py_compile train.py`.
hla_immunogenicity	constrained	1	11	43270f9											0.930305			0					discard				304.328706	46		Modified `/Volumes/KINGSTON/work/research/AutoNeoAg/train.py` to add `ScalarContextAgreementBlock`, which mixes `contrast_scalar_hidden` and `pair_scalar_context_hidden` using concat, absolute-difference, and elementwise-product terms. Wired that HLA-conditioned scalar agreement state into both the contrast head and final conditioning path, with the same light residual treatment used by the other contrast-side branches. Verified with `python -m py_compile train.py`.
hla_immunogenicity	constrained	1	12	90c8bfc											0.927741			0					discard				304.280933	39		Modified `/Volumes/KINGSTON/work/research/AutoNeoAg/train.py` to add `PairContextContrastGate`, a small residual gating block that mixes `contrast_scalar_hidden` with the existing HLA-conditioned `pair_scalar_context_hidden` using concat, absolute-difference, and elementwise-product terms, then applies the update before contrast-agreement and preference-context processing. Wired the gate into model construction and forward execution without changing objectives, sampling, loss weighting, or output dimensions. Verified with `python -m py_compile train.py`.
hla_immunogenicity	constrained	1	13	008c759											0.912321			0					discard				304.194981	41		Modified [/Volumes/KINGSTON/work/research/AutoNeoAg/train.py](/Volumes/KINGSTON/work/research/AutoNeoAg/train.py#L457) to add `MutantSupportBlock`, which fuses `mut_preference_hidden` with the existing HLA-conditioned `pair_scalar_context_hidden` using concat, absolute-difference, and elementwise-product terms. Wired that hidden state into contrast-head sizing and final conditioning in [/Volumes/KINGSTON/work/research/AutoNeoAg/train.py](/Volumes/KINGSTON/work/research/AutoNeoAg/train.py#L543) and into the forward path in [/Volumes/KINGSTON/work/research/AutoNeoAg/train.py](/Volumes/KINGSTON/work/research/AutoNeoAg/train.py#L616) so it contributes to both the contrast branch and fusion conditioning. Verified with `python -m py_compile train.py`.
hla_immunogenicity	constrained	1	14	4d5e9b6											0.866528			0					discard				304.262661	23		Modified `/Volumes/KINGSTON/work/research/AutoNeoAg/train.py` so `HLAConditionedContrastScalars` now projects comparison/context scalars together with both the HLA embedding and the existing average WT/Mut preference state, including explicit scalar-by-HLA and scalar-by-preference interactions. Wired the forward path to pass `average_preference_hidden` into that existing contrast-scalar tower, without changing losses, sampling, or adding a new head/branch. Verified with `python -m py_compile train.py`.
hla_immunogenicity	constrained	1	15	6be9d75											0.929364			0					discard				304.253667	35		Modified `/Volumes/KINGSTON/work/research/AutoNeoAg/train.py` to add `PreferenceContrastGate` at around lines 392-417, a small residual sigmoid gate that mixes `preference_delta_hidden` with the existing HLA-conditioned `contrast_scalar_hidden` using concat, absolute-difference, and elementwise-product terms. Wired it into model construction around lines 550-554 and into the forward path around lines 621-627 so the contrast-scalar state is refined before the existing agreement and preference-context branches. Verified with `python -m py_compile train.py`.
hla_immunogenicity	constrained	1	16	26f73c0											0.911051			0					discard				304.043765	46		Modified `/Volumes/KINGSTON/work/research/AutoNeoAg/train.py` to add `PairPreferenceSupportBlock` at line 457, which fuses `average_preference_hidden` with the existing HLA-conditioned `pair_scalar_context_hidden` using concat, absolute-difference, and elementwise-product terms. Wired that hidden state into model sizing around lines 555-570 and into the forward path around lines 620-694 so it contributes to both the contrast head and final conditioning stack alongside the existing contrast-scalar, agreement, preference-context, and pair-scalar branches. Verified with `python -m py_compile train.py`. 
hla_immunogenicity	constrained	1	17	57daea1											0.927588			0					discard				304.294411	36		Modified `/Volumes/KINGSTON/work/research/AutoNeoAg/train.py` so `HLAConditionedPairScalars` no longer projects the full base scalar block as one flat vector. It now splits the base features into mutant, wildtype, and shared components; projects mutant and wildtype support separately; forms explicit pair-mean and pair-gap hidden states; and mixes those with shared scalar context, HLA context, and average allele-preference state inside the existing pair-context branch. No other files were touched. Verified with `python -m py_compile train.py`.
hla_immunogenicity	constrained	1	18	2c12fbc											0.900268			0					discard				304.492748	28		Modified `/Volumes/KINGSTON/work/research/AutoNeoAg/train.py` in `HLAConditionedPairScalars` at lines 425-474 so the existing pair-scalar branch now splits normalized base scalars into mutant, wildtype, and shared components; projects them separately; forms a pair-mean hidden state plus an HLA-conditioned mutant-vs-wildtype support-gap interaction; and feeds those alongside the original flat scalar/HLA/preference signals into the same output-width mix block. No other files were touched. Verified with `python -m py_compile train.py`.
hla_immunogenicity	constrained	1	19	80876f1														0					discard	train_failed	train_failed			47		Modified train.py so `HLAConditionedContrastScalars` now also projects a compact pair-support summary built from normalized mutant support, wildtype support, their mean, and their gap from the base scalar block, and mixes that summary with the existing comparison/context scalar state and HLA state inside the same contrast tower. Wired the new summary through `NeoantigenRanker` without changing objectives, sampling, or other files. Verified with `python -m py_compile train.py`. [train failed]
hla_immunogenicity	constrained	1	20	e3305e7											0.900013			0					discard				304.393454	88		Modified [train.py](/Volumes/KINGSTON/work/research/AutoNeoAg/train.py#L345) so `HLAConditionedContrastScalars` now projects `comparison` and `context` scalar blocks separately, then mixes them with HLA-conditioned product and absolute-difference terms instead of flattening them into one scalar vector. Wired the new tower signature through model construction and forward execution in [train.py](/Volumes/KINGSTON/work/research/AutoNeoAg/train.py#L533) and [train.py](/Volumes/KINGSTON/work/research/AutoNeoAg/train.py#L604). Verified with `python -m py_compile train.py`.
hla_immunogenicity	constrained	1	21	c693812											0.903718			0					discard				304.631949	12		Modified `/Volumes/KINGSTON/work/research/AutoNeoAg/train.py` so `PreferenceContextBlock` now mixes mutant-supported contrast, wildtype-supported contrast, preference-delta-supported contrast, absolute preference gap, and the original contrast scalar state, instead of using average preference and preference-product terms. This keeps the same block width and wiring while making the existing preference-context branch more explicitly WT-vs-Mut contrast-aware. Verified with `python -m py_compile train.py`.
hla_immunogenicity	constrained	1	22	b75a7c9											0.928022			0					discard				304.927023	11		Modified `/Volumes/KINGSTON/work/research/AutoNeoAg/train.py` so `PreferenceContextBlock` now consumes the existing `pair_scalar_context_hidden` alongside `contrast_scalar_hidden`, replacing the prior symmetric `mut_preference * wt_preference` term with explicit absolute pair-support context and a `contrast_scalars * pair_scalar_context` interaction. Wired the new argument through `NeoantigenRanker.forward` and verified with `python -m py_compile train.py`.
hla_immunogenicity	constrained	1	23	92ef54d											0.924866			0					discard				304.591493	25		Modified [/Volumes/KINGSTON/work/research/AutoNeoAg/train.py](/Volumes/KINGSTON/work/research/AutoNeoAg/train.py#L366) so `ContrastAgreementBlock` now mixes `preference_delta_hidden` with both `contrast_scalar_hidden` and the existing `pair_scalar_context_hidden`, including explicit `preference_delta * pair_scalar_context` interaction terms. Wired the forward path in [/Volumes/KINGSTON/work/research/AutoNeoAg/train.py](/Volumes/KINGSTON/work/research/AutoNeoAg/train.py#L598) so the agreement block is computed when both HLA-conditioned scalar states are present. Verified with `python -m py_compile train.py`.
hla_immunogenicity	constrained	1	24	3b81c47											0.926831			0					discard				304.432267	43		Modified `/Volumes/KINGSTON/work/research/AutoNeoAg/train.py` to add `PreferenceContrastGate`, a small residual sigmoid gate that updates the existing HLA-conditioned `contrast_scalar_hidden` using `preference_delta_hidden`, `average_preference_hidden`, and their interactions with the contrast-scalar state. Wired it into `NeoantigenRanker` immediately after the contrast-scalar tower and before the existing agreement and preference-context blocks. Verified with `python -m py_compile train.py`.
hla_immunogenicity	constrained	1	25	eed4033											0.911922			0					discard				304.896718	42		Modified `/Volumes/KINGSTON/work/research/AutoNeoAg/train.py` to add `PairPreferenceGate` at lines 457-485, a small residual tanh gate that updates the existing `pair_scalar_context_hidden` from `preference_delta_hidden`, `average_preference_hidden`, and their interactions with the pair context. Wired it into model construction at line 549 and the forward path at lines 624-629 so the HLA-conditioned absolute pair-scalar branch is refined before feeding the existing contrast and fusion stacks. Verified with `python -m py_compile train.py`.
hla_immunogenicity	constrained	1	26	ce46149											0.928539			0					discard				304.619807	48		Modified `/Volumes/KINGSTON/work/research/AutoNeoAg/train.py` to add `ContrastPairRankBlock`, which fuses `contrast_scalar_hidden` and `pair_scalar_context_hidden` using signed difference, absolute difference, and elementwise product terms. Wired that new hidden state into `NeoantigenRanker` so it contributes to both the contrast head input and the final conditioning stack alongside the existing scalar, pair-context, agreement, and preference-context branches. Verified with `python -m py_compile train.py`.
hla_immunogenicity	constrained	1	27	485048c											0.874077			0					discard				304.587306	79		Modified `/Volumes/KINGSTON/work/research/AutoNeoAg/train.py` to add `SupportConditionedContrastBlock`, which splits normalized base scalars into mutant-support, wildtype-support, and shared components, forms explicit support-mean and support-gap states, and mixes them with `contrast_scalar_hidden`, `preference_delta_hidden`, and HLA context. Wired that new hidden state into both the contrast head input and the final conditioning stack, with a small residual contribution into `contrast_hidden`. No other files were touched. Verified with `python -m py_compile train.py`.
hla_immunogenicity	constrained	1	28	874de67											0.928403			0					discard				305.131016	19		Modified `/Volumes/KINGSTON/work/research/AutoNeoAg/train.py` so `PreferenceContextBlock` now mixes mutant-supported contrast, wildtype-supported contrast, the signed preference delta, and a preference-delta-by-pair-context interaction instead of the previous average/symmetric preference summary. Wired the block to require both `contrast_scalar_hidden` and the existing `pair_scalar_context_hidden` in `NeoantigenRanker.forward`. Verified with `python -m py_compile train.py`. 
hla_immunogenicity	constrained	1	29	6072adc											0.929383			0					discard				304.724384	21		Modified `train.py` so `HLAConditionedPairScalars` now consumes both `average_preference_hidden` and `preference_delta_hidden`, and mixes them with the base scalar/HLA state through explicit `scalar_hidden * preference_delta` interaction terms. Wired the new argument through `NeoantigenRanker.forward` when building `pair_scalar_context_hidden`. Verified with `python -m py_compile train.py`.
hla_immunogenicity	constrained	1	30	7592f50											0.890043			0					discard				304.497752	60		Modified [/Volumes/KINGSTON/work/research/AutoNeoAg/train.py#L425](/Volumes/KINGSTON/work/research/AutoNeoAg/train.py#L425) to add `DirectionalSupportBlock`, which builds mutant-supported and wildtype-supported contrast states from `preference_delta_hidden`, `contrast_scalar_hidden`, and `pair_scalar_context_hidden`, then mixes their signed and absolute gap structure. Wired that new hidden state into model sizing and forward execution in [/Volumes/KINGSTON/work/research/AutoNeoAg/train.py#L564](/Volumes/KINGSTON/work/research/AutoNeoAg/train.py#L564) and [/Volumes/KINGSTON/work/research/AutoNeoAg/train.py#L643](/Volumes/KINGSTON/work/research/AutoNeoAg/train.py#L643) so it contributes to both the contrast head and final conditioning stack. Verified with `python -m py_compile train.py`.
hla_immunogenicity	constrained	1	31	cb20046											0.910388			0					discard				304.528953	33		Modified `/Volumes/KINGSTON/work/research/AutoNeoAg/train.py` so `HLAConditionedContrastScalars` now consumes `preference_delta_hidden` and `average_preference_hidden` in addition to the existing scalar and HLA states, with an explicit `scalar_hidden * preference_delta` interaction term. Wired the new arguments through `NeoantigenRanker.forward` when building `contrast_scalar_hidden`. Verified with `python -m py_compile train.py`.
hla_immunogenicity	constrained	1	32	9deedf8											0.908691			0					discard				304.879905	50		Modified `train.py` to add `PreferenceDeltaContextBlock`, a small residual mixer over `preference_delta_hidden`, `average_preference_hidden`, `contrast_scalar_hidden`, and `pair_scalar_context_hidden`, including explicit delta-by-scalar interaction terms. Wired it into `NeoantigenRanker.forward` so `preference_delta_hidden` is refined before the existing agreement and contrast blocks, without changing objectives or touching any other file. Verified with `python -m py_compile train.py`.
