task_id	strategy	run_id	round_id	commit	worker_declared_family	worker_declared_subfamily	controller_inferred_family	controller_inferred_subfamily	proposal_family	proposal_subfamily	family_consensus	parent_round_id	parent_commit	search_mode	dev_score	confirm_score	blind_score	confirm_checked	confirm_round_score	confirm_survival	delta_vs_best	delta_vs_parent	status	decision_reason	failure_type	failure_mode	training_seconds	lines_changed	novelty_level	description
neoantigen	constrained	1	1	5ff5705											0.568195			0					keep				303.684704	0		baseline
neoantigen	constrained	1	2	08e928c											0.745040			0					keep				303.863554	63		Updated `train.py` only. Added two aligned comparison/context scalar features, introduced a compact scalar contrast head fed by comparison/context scalars plus HLA-conditioned preference deltas, and fused that hidden state into the main contrast and final conditioning path. `python -m py_compile train.py` passes.
neoantigen	constrained	1	3	dcec6d9											0.387581			0					discard				303.344626	25		Updated `train.py` only. Added a small `group_rank_head` that combines mut-vs-wt sequence deltas, HLA-conditioned interaction deltas, preference contrast, and comparison/context scalar contrast signals, then feeds that ranking hidden state back into final conditioning. Switched the default objective to `hybrid_pairwise` and kept training batch-capped for MPS/CPU safety instead of using full-dataset batches. `python -m py_compile train.py` passes.
neoantigen	constrained	1	4	3c0f3af											0.693136			0					discard				303.379336	57		Updated `train.py` only. Added two high-level context scalars (`foreignness_x_el_advantage`, `agretopicity_x_stability`) and introduced a small `HLAConditionedScalarEncoder` that conditions comparison/context scalars on HLA and WT/Mut preference context before the scalar contrast head, contrast stack, and final fusion. Kept the default BCE objective for stability and MPS/CPU compatibility. `python -m py_compile train.py` passes.
neoantigen	constrained	1	5	ad17b94											0.442076			0					discard				303.898021	46		Updated `train.py` only. Added a small `HLAInteractionHead`, fed it HLA-conditioned mut-vs-wt sequence interactions plus preference/scalar-contrast context, and fused its hidden state back into the main contrast inputs, conditioning path, and final logit with a modest auxiliary weight. Training objective, batching, and device compatibility remain MPS/CPU-safe. `python -m py_compile train.py` passes.
neoantigen	constrained	1	6	817c4a6											0.670961			0					discard				303.980545	94		Updated `train.py` only. Added one context scalar (`foreignness_x_el_advantage`), introduced a small `ScalarPairContrastHead` that splits the base scalar block into mut-side, wt-side, and shared views, conditions their contrast on the existing HLA preference hidden state, and feeds that representation back into the main contrast path, final conditioning, and logits with a modest auxiliary weight. `python -m py_compile train.py` passes.
neoantigen	constrained	1	7	08e928c											0.745040			0					discard	worker_failed	worker_failed			0		"codex exec failed | exit_code: 1 | stdout: | {""type"":""thread.started"",""thread_id"":""019d437f-6d1a-7d13-a4b2-2f150e3bce25""} | {""type"":""turn.started""} | {""type"":""error"",""message"":""You've hit your usage limit. To get more access now, send a request to your admin or try again at 8:36 PM.""} | {""type"":""turn.failed"",""error"":{""message"":""You've hit your usage limit. To get more access now, send a request to your admin or try again at 8:36 PM.""}} |  | stderr:"
hla_immunogenicity	constrained	1	1	5ff5705											0.898982			0					keep				304.929204	0		baseline
hla_immunogenicity	constrained	1	2	5ff5705											0.898982			0					discard	worker_failed	worker_failed			0		"codex exec failed | exit_code: 1 | stdout: | {""type"":""thread.started"",""thread_id"":""019d4384-5c57-7f60-9aff-14a31388ee77""} | {""type"":""turn.started""} | {""type"":""error"",""message"":""You've hit your usage limit. To get more access now, send a request to your admin or try again at 8:36 PM.""} | {""type"":""turn.failed"",""error"":{""message"":""You've hit your usage limit. To get more access now, send a request to your admin or try again at 8:36 PM.""}} |  | stderr:"
neoantigen	constrained	1	8	7573fc7											0.697454			0					discard				304.250932	72		Modified only `train.py`. Added `allele_context_logit_weight`, introduced a lightweight `AlleleContextHead`, split the existing base scalar block into mut-side, wt-side, and shared views, and built an asymmetric HLA-conditioned mut-vs-wt context delta that is fused into the main contrast path and final conditioning. No loss/sampling/pooling changes were made. Verification: `python -m py_compile train.py` passed.
neoantigen	constrained	1	9	24180e3											0.469535			0					discard				304.232842	56		Modified only `train.py`. Added `allele_scalar_logit_weight`, introduced a lightweight `AlleleScalarInteractionHead`, split the existing base scalar block into mut-side, wt-side, and shared views, and combined those with the existing HLA-conditioned mut-vs-wt interaction summary plus preference-delta hidden state. The new hidden state is fused into both the main contrast inputs and final conditioning, with a small auxiliary logit. No objective, sampling, pooling, or device-compatibility changes were made. Verification: `python -m py_compile train.py` passed.
neoantigen	constrained	1	10	21a0c83														0					discard	train_failed	train_failed			33		Modified only `train.py`. Added a lightweight `base_scalar_pair_head` that splits the normalized base scalar block into mut-side, wt-side, and shared components, combines those with the existing HLA-conditioned preference-delta hidden state, and feeds the resulting representation into both the main WT-vs-Mut contrast inputs and final conditioning stack. No objective, loss weighting, sampling, pooling, or output-bias changes were made. Verification: `python -m py_compile train.py` passed. [train failed]
neoantigen	constrained	1	11	22aa831											0.550852			0					discard				304.259552	49		Read `program.md` and `train.py`, then modified only `train.py`. Added a small `ScalarPairContext` module, built a HLA-conditioned base-scalar pair hidden state from mut-side and wt-side binding scalars plus their difference/product and shared base context, and fused that hidden state into the existing WT-vs-Mut contrast inputs and final conditioning path. No objective, loss, sampling, pooling, or output-bias changes were made. Verification: `python -m py_compile train.py` passed.
neoantigen	constrained	1	12	95ab24a											0.310088			0					discard				303.737746	40		Read `program.md` and `train.py`, then modified only `train.py`. Added `rank_context_logit_weight` plus a small `RankContextHead` that consumes the existing comparison/context scalar block, the HLA-conditioned WT-vs-Mut preference delta hidden state, and the allele interaction delta (`mut_hla - wt_hla`). Its hidden state is fused back into the main contrast inputs and final conditioning path, with a small auxiliary logit. No loss, sampling, pooling, or device-compatibility changes were made. Verification: `python -m py_compile train.py` passed.
neoantigen	constrained	1	13	6a9d4fd											0.344130			0					discard				303.551687	10		Read `program.md` and `train.py`, then modified only `train.py`. Added a small base-binding scalar view to the existing scalar-contrast path by appending normalized mut-side binding scalars, wt-side binding scalars, and their WT-vs-Mut deltas before the HLA-conditioned scalar contrast head. This keeps the change at the scalar WT-vs-Mut representation level, with no objective, sampling, pooling, or device-compatibility changes. Verification: `python -m py_compile train.py` passed.
neoantigen	constrained	1	14	5bcb54b											0.730948			0					discard				303.862439	52		Read `program.md` and `train.py`, then modified only `train.py`. Added a lightweight `ScalarPreferenceContext` module and used it to derive side-specific mut and wt scalar contexts from the normalized base feature block (`mut` binding quartet, `wt` binding quartet, their delta/product, and shared base context). Those side-specific scalar contexts are appended to the existing HLA-conditioned mut and wt preference inputs before forming the WT-vs-Mut preference delta that feeds the main contrast path. No loss, sampling, pooling, or output-bias changes were made. Verification: `python -m py_compile train.py` passed.
neoantigen	constrained	1	15	38fc8b2											0.702654			0					discard				303.694452	22		Read `program.md` and `train.py`, then modified only `train.py`. Reworked the existing HLA preference branch so it now consumes one joint WT-vs-Mut allele-conditioned input block `[mut, wt, hla, mut*h=hla, wt*h=hla, mut-wt, |mut-wt|, mut_hla-wt_hla]` and produces the preference hidden state/logit directly, rather than subtracting two independently encoded mut and wt preference states. This is a small contrast-head/HLA-interaction change with no loss, sampling, pooling, or output-bias edits. Verification: `python -m py_compile train.py` passed.
neoantigen	constrained	1	16	1f52870											0.487798			0					discard				303.890130	33		Read `program.md` and `train.py`, then modified only `train.py`. Added `preference_pair_logit_weight` and a lightweight `preference_pair_head` that consumes the existing mut and wt HLA-conditioned preference hidden states, their delta, their interaction product, and the existing comparison/context scalar block when present. Its hidden state is fused into both the main WT-vs-Mut contrast inputs and final conditioning stack, with a small auxiliary logit. Verification: `python -m py_compile train.py` passed.
neoantigen	constrained	1	17	e670862											0.757758			0					keep				303.655370	59		Read `program.md` and `train.py`, then modified only `train.py`. Added a lightweight `PreferenceContextEncoder` that builds one shared scalar competition embedding from the normalized base scalar block (`mut` binding quartet, `wt` binding quartet, their delta/product, shared base context) plus the HLA-conditioned sequence interaction `mut_hla - wt_hla`. That shared embedding is appended to both mut and wt preference inputs before the existing WT-vs-Mut preference delta is computed. Verification: `python -m py_compile train.py` passed.
neoantigen	constrained	1	18	1e45872											0.728463			0					discard				303.696494	44		Read `program.md` and `train.py`, then modified only `train.py`. Added a lightweight `base_competition_context` encoder that consumes the same round-17 shared scalar competition inputs plus the existing HLA-conditioned preference delta hidden state. Its hidden state is appended to the main WT-vs-Mut contrast inputs and to final conditioning before fusion. No objective, loss, sampling, pooling, or output-bias changes were made. Verification: `python -m py_compile train.py` passed.
neoantigen	constrained	1	19	45fa684											0.759939			0					keep				303.597619	25		Read `program.md` and `train.py`, then modified only `train.py`. Added `preference_contrast_logit_weight` and a lightweight `preference_contrast_head` that consumes the existing mut and wt HLA-conditioned preference hidden states, their delta, their elementwise product, and the HLA-conditioned sequence competition term `mut_hla - wt_hla`. Its hidden state is fused into both the main WT-vs-Mut contrast inputs and final conditioning stack, with a small auxiliary logit. Verification: `python -m py_compile train.py` passed.
neoantigen	constrained	1	20	5a7871e											0.519500			0					discard				304.151291	63		Read `program.md` and `train.py`, then modified only `train.py`. Added a lightweight `PreferenceStateGate` that consumes the existing base scalar competition block plus the shared preference-context embedding, and uses it to produce separate mut-side and wt-side gates for the two HLA-conditioned preference hidden states before the current WT-vs-Mut preference delta and joint preference-contrast head are formed. No objective, loss weighting, sampling, pooling, or output-bias changes were made. Verification: `python -m py_compile train.py` passed.
neoantigen	constrained	1	21	7b16def											0.192887			0					discard				304.372866	55		Read `program.md` and `train.py`, then modified only `train.py`. Expanded the existing `preference_contrast_head` input so the round-17 shared scalar/HLA competition embedding is fed directly into the round-19 joint WT-vs-Mut preference-contrast head, while reusing the same shared context for both side-specific preference encoders. No objective, loss weighting, sampling, pooling, or output-bias changes were made. Verification: `python -m py_compile train.py` passed.
neoantigen	constrained	1	22	6adaf88											0.594486			0					discard				303.796545	8		Read `program.md` and `train.py`, then modified only `train.py`. Expanded `scalar_contrast_head` so the comparison/context scalar branch now consumes both the existing WT-vs-Mut preference delta hidden state and the existing joint preference-contrast hidden state, instead of conditioning on the preference delta alone. This is a narrow scalar/contrast representation change intended to preserve richer HLA-conditioned mut-vs-wt competition information inside the scalar contrast path while avoiding the direct round-21 wiring into the preference-contrast head. Verification: `python -m py_compile train.py` passed.
neoantigen	constrained	1	23	be78dcf											0.524782			0					discard				304.039141	8		Read `program.md` and `train.py`, then modified only `train.py`. Expanded `scalar_contrast_head` so the comparison/context scalar branch now consumes the existing WT-vs-Mut preference delta hidden state plus the direct HLA-conditioned sequence competition term `mut_hla - wt_hla`. This keeps the change narrow and representation-level, focused on scalar contrast plus HLA-conditioned interaction structure. Verification: `python -m py_compile train.py` passed.
neoantigen	constrained	1	24	2d62bff											0.519175			0					discard				303.736446	44		Read `program.md` and `train.py`, then modified only `train.py`. Added a lightweight `preference_competition_context` encoder derived from the normalized base binding quartets (`mut`, `wt`, their delta, and product) plus the existing HLA-conditioned sequence competition term `mut_hla - wt_hla`. That compact competition embedding is fed directly into the existing joint WT-vs-Mut `preference_contrast_head`, while leaving objectives, scalar loss weighting, pooling, sampling, and output-bias behavior unchanged. Verification: `python -m py_compile train.py` passed.
neoantigen	constrained	1	25	f21651c											0.505936			0					discard				304.062597	34		Read `program.md` and `train.py`, then modified only `train.py`. Added a compact `PreferenceDeltaGate` and used it to form the WT-vs-Mut preference delta from a learned joint balance over mut and wt preference states, conditioned on `mut_hla - wt_hla` plus the existing shared base preference context when present. This keeps the change small, high-level, and representation-focused without touching losses, sampling, pooling, or other files. Verification: `python -m py_compile train.py` passed.
neoantigen	constrained	1	26	27acb1e											0.601852			0					discard				304.239502	42		Read `program.md` and `train.py`, then modified only `train.py`. Expanded `scalar_contrast_head` so the comparison/context scalar branch now consumes both the existing WT-vs-Mut preference delta hidden state and the kept round-17 shared preference-context embedding derived from base binding competition plus `mut_hla - wt_hla`. This keeps the edit narrow and representation-focused while preserving more HLA-conditioned scalar competition context inside the scalar contrast path. Verification: `python -m py_compile train.py` passed.
neoantigen	constrained	1	27	1c89c0a											0.668191			0					discard				304.763389	47		Read `program.md` and `train.py`, then modified only `train.py`. The existing `base_preference_context` encoder is now applied twice with ordered inputs: once for a mut-side context using `[mut_binding, wt_binding, mut-wt, product, shared_base, mut_hla-wt_hla]` and once for a wt-side context using the mirrored ordering `[wt_binding, mut_binding, wt-mut, product, shared_base, wt_hla-mut_hla]`. Those role-specific contexts are appended to the corresponding mut and wt preference inputs before the existing preference heads, while all downstream objectives and fusion structure remain unchanged. Verification: `python -m py_compile train.py` passed.
neoantigen	constrained	1	28	b42ea20											0.618468			0					discard				304.018917	21		Read `program.md` and `train.py`, then modified only `train.py`. Added a lightweight `preference_balance_context` encoder that consumes the average of the mut and wt preference states, the magnitude of their difference, and the existing HLA-conditioned sequence competition term `mut_hla - wt_hla`. That hidden state is appended to the main WT-vs-Mut contrast inputs and to final conditioning before fusion, while leaving objectives, sampling, pooling, and output-bias behavior unchanged. Verification: `python -m py_compile train.py` passed.
neoantigen	constrained	1	29	27aa5df											0.541865			0					discard				303.562553	28		Read `program.md` and `train.py`, then modified only `train.py`. Added `interaction_balance_logit_weight` and a lightweight `interaction_balance_head` that consumes `average_peptide * hla`, the average of `mut_hla` and `wt_hla`, the magnitude `abs(mut_hla - wt_hla)`, and the existing comparison/context scalar block when present. Its hidden state is fused into both the main WT-vs-Mut contrast inputs and final conditioning stack, with a small auxiliary logit. Verification: `python -m py_compile train.py` passed.
neoantigen	constrained	1	30	0ea5005											0.534654			0					discard				303.909040	16		Read `program.md` and `train.py`, then modified only `train.py`. Added a lightweight `preference_delta_refiner` that consumes the existing preference delta hidden state, the average of mut and wt preference states, the magnitude of that delta, and the direct HLA-conditioned interaction term `mut_hla - wt_hla`, then feeds a small residual refinement back into `preference_delta_hidden` before the existing scalar-contrast and main contrast heads. Verification: `python -m py_compile train.py` passed.
neoantigen	constrained	1	31	f567ea0											0.531127			0					discard				304.112668	18		Read `program.md` and `train.py`, then modified only `train.py`. Added a lightweight `preference_balance_context` encoder that consumes the average of mut and wt preference states, the magnitude of their difference, and the direct HLA-conditioned sequence competition term `mut_hla - wt_hla`. That hidden state is now fed into the existing joint WT-vs-Mut `preference_contrast_head`, while leaving losses, sampling, pooling, and output-bias behavior unchanged. Verification: `python -m py_compile train.py` passed.
neoantigen	constrained	1	32	c2b619f											0.407471			0					discard				304.108217	23		Read `program.md` and `train.py`, then modified only `train.py`. Added a lightweight `preference_balance_context` encoder that consumes the average of mut and wt preference states, the magnitude of their difference, and the direct HLA-conditioned interaction term `mut_hla - wt_hla`. Expanded `scalar_contrast_head` so the comparison/context scalar branch now consumes both the existing WT-vs-Mut preference delta hidden state and this new preference-balance context, while leaving the main preference-contrast head and objectives unchanged. Verification: `python -m py_compile train.py` passed.
neoantigen	constrained	1	33	f3a258e											0.755970			0					discard				304.637435	9		Read `program.md` and `train.py`, then modified only `train.py`. Expanded `preference_contrast_head` so the joint WT-vs-Mut preference-contrast branch now consumes three HLA-conditioned interaction views: the existing signed delta `mut_hla - wt_hla`, the absolute competition baseline `0.5 * (mut_hla + wt_hla)`, and the competition magnitude `abs(mut_hla - wt_hla)`. This keeps the change narrow and representation-focused around the WT-vs-Mut contrast path and HLA-conditioned interaction structure. Verification: `python -m py_compile train.py` passed.
neoantigen	constrained	1	34	e3d8fcc											0.569813			0					discard				303.847833	61		Read `program.md` and `train.py`, then modified only `train.py`. Added a lightweight `scalar_preference_context` encoder that consumes the normalized comparison/context scalar blocks together with three HLA-conditioned competition views: `mut_hla - wt_hla`, `0.5 * (mut_hla + wt_hla)`, and `abs(mut_hla - wt_hla)`. That compact context is appended only to the existing joint WT-vs-Mut `preference_contrast_head`, keeping the edit narrow and representation-focused around scalar feature blocks plus HLA-conditioned contrast structure. Verification: `python -m py_compile train.py` passed.
