task_id	strategy	run_id	round_id	commit	worker_declared_family	worker_declared_subfamily	controller_inferred_family	controller_inferred_subfamily	proposal_family	proposal_subfamily	family_consensus	parent_round_id	parent_commit	search_mode	dev_score	confirm_score	blind_score	confirm_checked	confirm_round_score	confirm_survival	delta_vs_best	delta_vs_parent	status	decision_reason	failure_type	failure_mode	training_seconds	lines_changed	novelty_level	description
neoantigen	constrained	1	66	3aef30f											0.636823			0					discard				303.699732	55		Read `program.md` and `train.py`, then modified only `train.py`. Added `hla_contrast_context`, a lightweight encoder over the existing comparison/context scalar slice, shared peptide-HLA support (`average_peptide * hla`), and signed peptide-HLA advantage (`mut_hla - wt_hla`). Its hidden state now feeds both `preference_contrast_head` and the main `contrast_head`, keeping the change narrow and focused on explicit WT-vs-Mut contrast structure plus HLA-conditioned interaction support. Verification: `python -m py_compile train.py` passed.
neoantigen	constrained	1	67	a01d818											0.686769			0					discard				303.466315	26		Read `program.md` and `train.py`, then modified only `train.py`. Widened the existing `preference_contrast_head` and `contrast_head` inputs so they now consume direct HLA-conditioned interaction structure: `shared_hla_support` (`average_peptide * hla`), signed `hla_advantage` (`mut_hla - wt_hla`), `hla_advantage_magnitude` (`abs(mut_hla - wt_hla)`), and `shared_hla_match` (`mut_hla * wt_hla`). Reused these terms where related context inputs already referenced peptide-HLA interactions, keeping the change narrow and focused on explicit WT-vs-Mut contrast plus HLA-conditioned structure. Verification: `python -m py_compile train.py` passed.
neoantigen	constrained	1	68	7ae1e8e											0.697716			0					discard				303.858718	4		Read `program.md` and `train.py`, then modified only `train.py`. Widened the main `contrast_head` input to consume two direct cross-contrast signals when the scalar contrast branch is present: `preference_contrast_hidden * scalar_contrast_hidden` and `abs(preference_contrast_hidden - scalar_contrast_hidden)`. This keeps the change narrow and focused on explicit WT-vs-Mut contrast agreement between sequence/HLA and scalar evidence. Verification: `python -m py_compile train.py` passed.
neoantigen	constrained	1	69	72f4636											0.660566			0					discard				303.633843	31		Read `program.md` and `train.py`, then modified only `train.py`. Added a new default scalar block, `calibration`, with five higher-level features: `ba_score_rank_consensus`, `el_score_rank_consensus`, `mean_log_ba_x_ba_consensus`, `mean_el_x_el_consensus`, and `stability_x_el_consensus`. Routed that block into the selected scalar matrix and widened the existing scalar contrast / contrast-conditioning path from `comparison/context` to `comparison/context/calibration`, keeping the change narrow and representation-focused. Verification: `python -m py_compile train.py` passed.
neoantigen	constrained	1	70	c293ba0											0.117653			0					discard				309.619534	34		Read `program.md` and `train.py`, then modified only `train.py`. Added a new default scalar block, `dominance`, with five scale-aware WT-vs-Mut competition features: `ba_dominance`, `el_dominance`, `ba_rank_dominance`, `el_rank_dominance`, and `stability_x_mean_dominance`. Routed that block into the selected scalar matrix and widened the existing scalar contrast / contrast-conditioning path from `comparison/context` to `comparison/context/dominance`. Also changed the default objective from `bce` to a modest `hybrid_pairwise` setting with `pairwise_weight=0.20`, pairing the ranking loss change with the new ranking-oriented representation block. Verification: `python -m py_compile train.py` passed.
neoantigen	constrained	1	71	a66061a											0.702441			0					discard				303.238009	3		Read `program.md` and `train.py`, then modified only `train.py`. Widened the main `contrast_head` input so that, when `binding_contrast_hidden` is present, it also consumes two direct HLA-conditioned cross-contrast signals: `preference_contrast_hidden * binding_contrast_hidden` and `abs(preference_delta_hidden - binding_contrast_hidden)`. This keeps the change narrow and focused on explicit WT-vs-Mut contrast structure plus peptide-HLA interaction consistency. Verification: `python -m py_compile train.py` passed.
neoantigen	constrained	1	72	865aebb											0.741147			0					discard				303.676402	13		Read `program.md` and `train.py`, then modified only `train.py`. Added `preference_contrast_conditioner`, a small FiLM-style conditioner driven by the existing `binding_contrast_hidden`, and applied it directly to `preference_contrast_hidden` after the preference-contrast head. This keeps the change narrow and aligned with the program priority on strengthening WT-vs-Mut contrast structure plus HLA-conditioned interactions, while avoiding objective-only or pooling-only tweaks. Verification: `python -m py_compile train.py` passed.
neoantigen	constrained	1	73	06cb06a											0.761664			0					discard				303.156019	39		Read `program.md` and `train.py`, then modified only `train.py`. Added a new default scalar block, `competition`, with seven features: `shared_ba_support`, `shared_el_support`, `ba_relative_margin`, `el_relative_margin`, `ba_rank_relative_margin`, `el_rank_relative_margin`, and `shared_support_x_margin`. Routed that block into the selected scalar matrix and widened the existing scalar contrast / contrast-conditioning path from `comparison/context` to `comparison/context/competition`, keeping the change narrow and representation-focused. Verification: `python -m py_compile train.py` passed.
neoantigen	constrained	1	74	2240ed2											0.677419			0					discard				303.152082	32		Read `program.md` and `train.py`, then modified only `train.py`. Added a new default scalar block, `coherence`, with five higher-level features: `ba_el_preference_agreement`, `rank_preference_agreement`, `shared_support_x_preference_agreement`, `stability_x_preference_agreement`, and `foreignness_x_preference_agreement`. Routed that block into the selected scalar matrix and widened the existing scalar contrast / contrast-conditioning path from `comparison/context` to `comparison/context/coherence`, keeping the change narrow and representation-focused. Verification: `python -m py_compile train.py` passed.
neoantigen	constrained	1	75	39b257c											0.749318			0					discard				302.950392	20		Read `program.md` and `train.py`, then modified only `train.py`. Added `mutation_contrast_context`, a lightweight encoder over mutation-exposed HLA interaction structure: `delta * hla`, `(mut - wt) * hla`, and `abs(mut_hla - wt_hla)`. Routed its hidden state into both `preference_contrast_head` and the main `contrast_head`, keeping the change narrow and aligned with the program priority on WT-vs-Mut contrast structure plus HLA-conditioned interactions. Verification: `python -m py_compile train.py` passed.
neoantigen	constrained	1	76	f372b07											0.711446			0					discard				303.102179	13		Read `program.md` and `train.py`, then modified only `train.py`. Widened `scalar_contrast_head` so that, when `binding_contrast_hidden` is present, the scalar WT-vs-Mut contrast path now also consumes two direct agreement signals: `preference_delta_hidden * binding_contrast_hidden` and `abs(preference_delta_hidden - binding_contrast_hidden)`, alongside the existing scalar comparison/context inputs and HLA-conditioned binding context. This keeps the change narrow and focused on scalar feature interpretation plus explicit WT-vs-Mut/HLA-conditioned contrast structure. Verification: `python -m py_compile train.py` passed.
neoantigen	constrained	1	77	652e5d7											0.719612			0					discard				303.105341	15		Read `program.md` and `train.py`, then modified only `train.py`. Widened `scalar_contrast_head` so it now consumes `preference_contrast_hidden` in addition to the prior scalar comparison/context inputs and `preference_delta_hidden`; when `binding_contrast_hidden` is present, it also receives direct HLA-conditioned agreement terms `preference_contrast_hidden * binding_contrast_hidden` and `abs(preference_contrast_hidden - binding_contrast_hidden)`. This keeps the round focused on scalar feature interpretation, WT-vs-Mut contrast structure, and HLA-conditioned interaction consistency. Verification: `python -m py_compile train.py` passed.
neoantigen	constrained	1	78	e43a898											0.680714			0					discard				303.241883	26		Read `program.md` and `train.py`, then modified only `train.py`. Widened `preference_contrast_head` so that, when `binding_contrast_hidden` is present, it also consumes the HLA-conditioned binding-contrast state together with two direct alignment signals: `preference_delta_hidden * binding_contrast_hidden` and `abs(preference_delta_hidden - binding_contrast_hidden)`. This keeps the round narrow and focused on explicit WT-vs-Mut contrast structure plus HLA-conditioned interaction consistency. Verification: `python -m py_compile train.py` passed.
neoantigen	constrained	1	79	0b856c9											0.501148			0					discard				303.307669	10		Read `program.md` and `train.py`, then modified only `train.py`. Widened the main `contrast_head` input from seven to eleven sequence-width channels and added four explicit directional tensors in `forward`: `relu(mut - wt)`, `relu(wt - mut)`, `relu(mut_hla - wt_hla)`, and `relu(wt_hla - mut_hla)`. This keeps the round narrow and focused on stronger WT-vs-Mut contrast structure plus HLA-conditioned interaction directionality. Verification: `python -m py_compile train.py` passed.
neoantigen	constrained	1	80	d467273											0.753690			0					discard				303.629028	32		Read `program.md` and `train.py`, then modified only `train.py`. Added `interaction_contrast_head`, a compact dedicated HLA-conditioned WT-vs-Mut interaction branch that consumes `preference_delta_hidden`, `preference_contrast_hidden`, `binding_contrast_hidden`, their elementwise product, and their absolute difference. Routed its hidden state into both the main `contrast_head` input and the final fusion conditioning stack, and let its auxiliary logit contribute alongside the existing scalar-contrast auxiliary term. Verification: `python -m py_compile train.py` passed.
neoantigen	constrained	1	81	b065aba											0.649263			0					discard				303.244012	33		Read `program.md` and `train.py`, then modified only `train.py`. Added a compact `interaction_contrast_head` over `preference_delta_hidden`, `preference_contrast_hidden`, `binding_contrast_hidden`, their elementwise product, and their absolute difference. Routed its hidden state into the existing scalar WT-vs-Mut contrast path and the main contrast head, while deliberately not adding new loss terms or final-fusion wiring so the change stays narrow and representation-focused. Verification: `python -m py_compile train.py` passed.
neoantigen	constrained	1	82	7aeb21c											0.706446			0					discard				303.097514	54		Read `program.md` and `train.py`, then modified only `train.py`. Added `preference_scalar_context`, a compact encoder over comparison/context scalars plus `preference_delta_hidden` and optional `binding_contrast_hidden`, and routed its hidden state into `preference_contrast_head`. This keeps round 82 focused on higher-level scalar feature interpretation plus a stronger explicit WT-vs-Mut contrast path, without changing objectives, sampling, or pooling. Verification: `python -m py_compile train.py` passed.
neoantigen	constrained	1	83	2b11f6c											0.215585			0					discard				309.967816	39		Read `program.md` and `train.py`, then modified only `train.py`. Added a new default scalar block, `priority`, with six mutant-focused ranking features: `mut_ba_win_x_support`, `mut_el_win_x_support`, `mut_ba_rank_win_x_support`, `mut_el_rank_win_x_support`, `mut_priority_foreignness`, and `mut_priority_stability`. Routed that block into the selected scalar matrix and widened the existing scalar contrast / contrast-conditioning path from `comparison/context` to `comparison/context/priority`. Also changed the default objective from `bce` to `hybrid_pairwise` with a conservative `pairwise_weight=0.20`, so the grouped ranking objective is explicitly paired with the new priority representation. Verification: `python -m py_compile train.py` passed.
neoantigen	constrained	1	84	4ccd58e											0.669518			0					discard				303.076519	31		Read `program.md` and `train.py`, then modified only `train.py`. Added a new default scalar block, `separation`, with six higher-level features: `ba_separation_margin`, `el_separation_margin`, `ba_rank_separation_margin`, `el_rank_separation_margin`, `foreignness_x_separation`, and `stability_x_separation`. Routed that block into the selected scalar matrix and widened the existing scalar contrast / contrast-conditioning path from `comparison/context` to `comparison/context/separation`, keeping the change narrow and representation-focused. Verification: `python -m py_compile train.py` passed.
neoantigen	constrained	1	85	59431a5											0.761751			0					discard				303.146801	24		Read `program.md` and `train.py`, then modified only `train.py`. Added `mutation_hla_context`, a lightweight HLA-conditioned mutation-context encoder over `delta`, `delta * hla`, `mut_hla - wt_hla`, and `abs(mut_hla - wt_hla)`. Routed its hidden state into both per-allele preference inputs and `preference_contrast_head`, keeping the edit narrow and aligned with the program priority on stronger WT-vs-Mut contrast structure plus HLA-conditioned interaction modeling. Verification: `python -m py_compile train.py` passed.
neoantigen	constrained	1	86	6327c92											0.617511			0					discard				303.307502	31		Read `program.md` and `train.py`, then modified only `train.py`. Added `mutation_hla_context`, a compact encoder over `delta`, `delta * hla`, `mut_hla - wt_hla`, and `abs(mut_hla - wt_hla)`. Routed its hidden state into the per-allele preference inputs, the `preference_contrast_head`, the scalar WT-vs-Mut contrast path, and the main contrast head so the model can carry mutation-aware HLA interaction structure earlier and more consistently through its contrast stack. Verification: `python -m py_compile train.py` passed.
neoantigen	constrained	1	87	9818b1f											0.715936			0					discard				303.280252	41		Read `program.md` and `train.py`, then modified only `train.py`. Added `scalar_binding_bridge`, a compact encoder over comparison/context scalars plus direct agreement and disagreement terms between `preference_delta_hidden` and `binding_contrast_hidden`. Routed that bridge hidden state into `scalar_contrast_head`, `contrast_conditioner`, and the main `contrast_head` so scalar WT-vs-Mut evidence is explicitly aligned with HLA-conditioned interaction structure where contrast decisions are made. Verification: `python -m py_compile train.py` passed.
neoantigen	constrained	1	88	1c58e0f											0.701255			0					discard				303.205543	31		Read `program.md` and `train.py`, then modified only `train.py`. Added a new default scalar feature block, `consensus`, with six higher-level WT-vs-Mut features: `ba_el_consensus`, `rank_consensus`, `mut_consensus_win`, `mut_rank_consensus_win`, `foreignness_x_consensus_win`, and `stability_x_consensus_win`. Routed that block into the selected scalar matrix and into the existing scalar-contrast inputs so the model can use explicit multi-signal mutant-vs-wildtype agreement where scalar contrast decisions are formed. Verification: `python -m py_compile train.py` passed.
neoantigen	constrained	1	89	f5f6556														0					discard	train_failed	train_failed			25		Read `program.md` and `train.py`, then modified only `train.py`. Added `directional_binding_context`, a lightweight encoder over `relu(mut - wt)`, `relu(wt - mut)`, `relu(mut_hla - wt_hla)`, `relu(wt_hla - mut_hla)`, and `delta * hla`. Routed its hidden state into `preference_contrast_head` and the main `contrast_head` so directional mutant-win versus wildtype-win HLA evidence is summarized explicitly where WT-vs-Mut decisions are formed. Verification: `python -m py_compile train.py` passed. [train failed]
neoantigen	constrained	1	90	ad96591											0.578848			0					discard				303.418777	22		Read `program.md` and `train.py`, then modified only `train.py`. Added `mutation_binding_context`, a compact HLA-conditioned mutation encoder over `delta`, `delta * hla`, `mut_hla - wt_hla`, `abs(mut_hla - wt_hla)`, and `(mut - wt) * hla`. Routed its hidden state into `preference_contrast_head` and the main `contrast_head`, keeping the edit focused on higher-level WT-vs-Mut contrast structure rather than losses or pooling. Verification: `python -m py_compile train.py` passed.
neoantigen	constrained	1	91	a30bc51											0.627211			0					discard				303.303512	34		Read `program.md` and `train.py`, then modified only `train.py`. Added a new default scalar feature block, `directional`, with explicit mutant-win and wildtype-win BA/EL channels plus within-side support products, and included that block in the existing scalar WT-vs-Mut contrast/conditioning path. Also changed the existing `binding_contrast_context` inputs from mixed average/product peptide-HLA terms to directional `relu(mut_hla - wt_hla)` and `relu(wt_hla - mut_hla)` interaction splits so HLA-conditioned contrast evidence is asymmetric where it is summarized. Verification: `python -m py_compile train.py` passed.
neoantigen	constrained	1	92	5be3628											0.661652			0					discard				303.406073	39		Read `program.md` and `train.py`, then modified only `train.py`. Added `scalar_preference_context`, a compact encoder over comparison/context scalars plus signed and absolute HLA-conditioned binding shift, and routed its hidden state into both mutant and wildtype preference inputs so scalar WT-vs-Mut evidence is available earlier when per-allele preference representations are formed. Also factored the repeated peptide-HLA interaction delta into `binding_shift` for the affected contrast paths. Verification: `python -m py_compile train.py` passed.
neoantigen	constrained	1	93	5ca2b17											0.572647			0					discard				303.175097	30		Read `program.md` and `train.py`, then modified only `train.py`. Added `mutation_preference_context`, a lightweight encoder over mutation and HLA-conditioned directional binding-shift features, and routed its hidden state only into the mutant and wildtype preference inputs. Also factored the repeated peptide-HLA interaction delta into `binding_shift` for reuse in the affected contrast calls. Verification: `python -m py_compile train.py` passed.
neoantigen	constrained	1	94	df8656d											0.759244			0					discard				303.343119	30		Read `program.md` and `train.py`, then modified only `train.py`. Added a new default scalar feature block, `support`, with six positive-margin WT-vs-Mut features: `mut_el_x_positive_ba_margin`, `mut_el_x_positive_el_margin`, `foreignness_x_positive_ba_margin`, `stability_x_positive_el_margin`, `delta_x_positive_ba_rank_margin`, and `agretopicity_x_positive_el_rank_margin`. Routed that block into the selected scalar matrix and widened the existing scalar contrast / contrast-conditioning path from `comparison/context` to `comparison/context/support`, keeping the change narrow and representation-focused. Verification: `python -m py_compile train.py` passed.
neoantigen	constrained	1	95	ca7a2aa											0.572899			0					discard				303.269893	22		Read `program.md` and `train.py`, then modified only `train.py`. Widened `preference_contrast_head` to accept `binding_contrast_hidden` when available, and passed that existing HLA-conditioned binding contrast summary into the WT-vs-Mut preference-contrast input alongside the mutant/wildtype preference states and raw `mut_hla - wt_hla` shift. This keeps round 95 small and focused on earlier contrast structure rather than losses, sampling, or pooling. Verification: `python -m py_compile train.py` passed.
neoantigen	constrained	1	96	806b89c											0.747707			0					discard				303.639065	81		Read `program.md` and `train.py`, then modified only `train.py`. Added a new default scalar feature block, `support`, with six positive mutant-win features: `mut_el_x_positive_ba_margin`, `mut_el_x_positive_el_margin`, `foreignness_x_positive_ba_margin`, `stability_x_positive_el_margin`, `delta_x_positive_ba_rank_margin`, and `agretopicity_x_positive_el_rank_margin`. Added `support_binding_context`, a compact encoder over those support scalars plus signed and directional HLA-conditioned binding shift (`mut_hla - wt_hla`, `relu(shift)`, `relu(-shift)`), and routed its hidden state into `preference_contrast_head` and the main `contrast_head`. Verification: `python -m py_compile train.py` passed.
neoantigen	constrained	1	97	dec05e1											0.784791			0					keep				303.314543	27		Read `program.md` and `train.py`, then modified only `train.py`. Added `contrast_agreement_context`, a compact encoder over `preference_delta_hidden`, `scalar_contrast_hidden`, `binding_contrast_hidden`, their HLA-conditioned agreement products, and the absolute gap between preference and scalar contrast summaries. Routed that hidden state only into the main `contrast_head` so the final WT-vs-Mut decision can use an explicit scalar-versus-binding coherence signal. Verification: `python -m py_compile train.py` passed.
