task_id	strategy	run_id	round_id	commit	worker_declared_family	worker_declared_subfamily	controller_inferred_family	controller_inferred_subfamily	proposal_family	proposal_subfamily	family_consensus	parent_round_id	parent_commit	search_mode	dev_score	confirm_score	blind_score	confirm_checked	confirm_round_score	confirm_survival	delta_vs_best	delta_vs_parent	status	decision_reason	failure_type	failure_mode	training_seconds	lines_changed	novelty_level	description
neoantigen	constrained	1	35	6b2942c											0.604090			0					discard				303.508870	30		Read `program.md` and `train.py`, then modified only `train.py`. Added a lightweight `scalar_hla_context` encoder that summarizes comparison/context scalars together with three HLA-conditioned interaction views: signed competition `mut_hla - wt_hla`, absolute support `average_peptide * hla`, and competition magnitude `abs(mut_hla - wt_hla)`. Expanded the existing `scalar_contrast_head` to consume that context alongside the prior scalar block and WT-vs-Mut preference delta, keeping the change narrow and representation-focused around scalar feature blocks plus HLA-conditioned contrast structure. Verification: `python -m py_compile train.py` passed.
neoantigen	constrained	1	36	1c72789											0.609913			0					discard				303.622651	28		Read `program.md` and `train.py`, then modified only `train.py`. Added a shared `scalar_preference_context` encoder that consumes the existing comparison/context scalar block together with three HLA-conditioned competition views: ordered signed competition (`mut_hla - wt_hla` for mut side, flipped for wt side), absolute support (`0.5 * (mut_hla + wt_hla)`), and competition magnitude (`abs(mut_hla - wt_hla)`). That compact context is appended directly to the existing mut and wt preference inputs before the WT-vs-Mut preference delta and downstream contrast heads are formed. Verification: `python -m py_compile train.py` passed.
neoantigen	constrained	1	37	9f486f1											0.677728			0					discard				303.932808	26		Read `program.md` and `train.py`, then modified only `train.py`. Added a lightweight `contrast_hla_context` encoder that summarizes comparison/context scalar blocks together with three HLA-conditioned interaction views: signed competition `mut_hla - wt_hla`, absolute support `0.5 * (mut_hla + wt_hla)`, and competition magnitude `abs(mut_hla - wt_hla)`. That hidden state now feeds the main WT-vs-Mut `contrast_head` and final conditioning stack, while all objectives, sampling, pooling, and output-bias behavior remain unchanged. Verification: `python -m py_compile train.py` passed.
neoantigen	constrained	1	38	f474743											0.717413			0					discard				303.888182	18		Read `program.md` and `train.py`, then modified only `train.py`. Added a lightweight `preference_delta_context` encoder that refines `preference_delta_hidden` using six views: the existing preference delta, the mean and magnitude of mut/wt preference states, and three HLA-conditioned competition summaries `mut_hla - wt_hla`, `0.5 * (mut_hla + wt_hla)`, and `abs(mut_hla - wt_hla)`. This keeps the change narrow and representation-focused around the WT-vs-Mut contrast path and HLA-conditioned interaction structure. Verification: `python -m py_compile train.py` passed.
neoantigen	constrained	1	39	e029ae2											0.604408			0					discard				303.788505	26		Read `program.md` and `train.py`, then modified only `train.py`. Replaced the fixed-size `ContrastConditioner` with a small reusable `FeatureConditioner`, added `scalar_hla_gate`, and used it to affine-modulate the existing comparison/context scalar block with three HLA-conditioned interaction summaries: `average_peptide * hla`, `mut_hla - wt_hla`, and `abs(mut_hla - wt_hla)` before the scalar contrast branch runs. This keeps the change narrow and representation-focused around scalar feature blocks plus HLA-conditioned WT-vs-Mut contrast structure. Verification: `python -m py_compile train.py` passed.
neoantigen	constrained	1	40	86105b1											0.608646			0					discard				303.908024	36		Read `program.md` and `train.py`, then modified only `train.py`. Added a shared `preference_state_conditioner` that consumes ordered base binding scalars, shared base features, allele-specific peptide-HLA interaction (`mut_hla` or `wt_hla`), and signed competition (`mut_hla - wt_hla` with role-aware ordering) to affine-modulate the mut and wt preference hidden states before `preference_delta_hidden` is computed. Verification: `python -m py_compile train.py` passed.
neoantigen	constrained	1	41	188555b											0.217560			0					discard				303.957309	33		Read `program.md` and `train.py`, then modified only `train.py`. Added a lightweight `competition_context` encoder that consumes ordered mut/wt binding scalars, their delta and product, plus four HLA-conditioned interaction views: `mut_hla`, `wt_hla`, `mut_hla - wt_hla`, and `average_peptide * hla`. That hidden state is injected into both the existing `preference_contrast_head` and the main `contrast_head`, keeping the change narrow and focused on WT-vs-Mut contrast structure plus HLA-conditioned interactions. Verification: `python -m py_compile train.py` passed.
neoantigen	constrained	1	42	b89584f											0.402778			0					discard				303.990341	59		Read `program.md` and `train.py`, then modified only `train.py`. Added a shared `ordered_scalar_preference_context` encoder over the existing comparison/context scalar blocks and fed it into the mut-side and wt-side preference inputs with role-aware ordering: the comparison block is kept as-is for mut and sign-flipped for wt, while context scalars stay shared. This is a small representation change focused on scalar feature blocks plus the WT-vs-Mut preference/contrast path, with no loss, sampling, pooling, or output-bias changes. Verification: `python -m py_compile train.py` passed.
neoantigen	constrained	1	43	061adf1											0.772614			0					keep				304.057694	38		Read `program.md` and `train.py`, then modified only `train.py`. Added a lightweight `binding_contrast_context` encoder that summarizes ordered mut/wt binding scalars, their delta and product, plus two HLA-conditioned absolute competition views: `average_peptide * hla` and `mut_hla * wt_hla`. That hidden state now feeds the existing `scalar_contrast_head` and main `contrast_head`, keeping the change narrow and focused on scalar feature blocks plus WT-vs-Mut contrast structure. Verification: `python -m py_compile train.py` passed.
neoantigen	constrained	1	44	ab3c7be											0.747938			0					discard				304.258325	18		Read `program.md` and `train.py`, then modified only `train.py`. Added a lightweight `preference_delta_refiner` that re-encodes `preference_delta_hidden` using four views: the raw mut-vs-wt preference delta, the mean of mut/wt preference states, the absolute preference separation, and the existing round-43 `binding_contrast_hidden` summarizing ordered binding scalars plus absolute HLA-conditioned competition (`average_peptide * hla`, `mut_hla * wt_hla`). This keeps the change narrow and focused on the WT-vs-Mut contrast structure plus HLA-conditioned interaction structure. Verification: `python -m py_compile train.py` passed.
neoantigen	constrained	1	45	94a474f											0.610041			0					discard				303.682734	23		Read `program.md` and `train.py`, then modified only `train.py`. Widened `preference_contrast_head` so it can consume `binding_contrast_hidden`, the existing round-43 encoder over ordered mut/wt binding scalars plus absolute HLA-conditioned competition (`average_peptide * hla`, `mut_hla * wt_hla`). In `forward`, that binding-competition context is now appended to the WT-vs-Mut preference-contrast input when available, keeping the change narrow and focused on the WT-vs-Mut contrast path plus HLA-conditioned interaction structure. Verification: `python -m py_compile train.py` passed.
neoantigen	constrained	1	46	8f9f0ff														0					discard	train_failed	train_failed			28		Read `program.md` and `train.py`, then modified only `train.py`. Changed the default objective from `bce` to `hybrid_pairwise`, added a lightweight `ranking_context` encoder on top of the existing round-43 `binding_contrast_hidden`, and fed that ranking-aware hidden state into both the main WT-vs-Mut `contrast_head` and final fusion conditioning. The new context is built from `preference_delta_hidden`, `preference_contrast_hidden`, and the existing absolute HLA-conditioned binding-competition summary, keeping the edit small and aligned with scalar/contrast/HLA-interaction priorities. Verification: `python -m py_compile train.py` passed. [train failed]
neoantigen	constrained	1	47	fefcdb4											0.593349			0					discard				303.774151	30		Read `program.md` and `train.py`, then modified only `train.py`. Added a new default `competition` scalar block with eight absolute WT-vs-Mut binding-regime features: mean mut/wt log BA, mean EL, mean BA/EL ranks, absolute log BA and EL gaps, and mut-wt product terms for log BA and EL. Routed that block through the existing scalar tower, scalar contrast head, and contrast conditioner by extending the contrast-scalar block selection from `comparison/context` to `comparison/context/competition`. No loss, sampling, pooling, or output-bias changes were made. Verification: `python -m py_compile train.py` passed.
neoantigen	constrained	1	48	f5e6af5											0.602789			0					discard				304.498721	8		Read `program.md` and `train.py`, then modified only `train.py`. Widened the existing `contrast_conditioner` so it consumes both the selected comparison/context scalar block and, when available, the round-43 `binding_contrast_hidden` built from ordered mut/wt binding scalars plus absolute HLA-conditioned competition (`average_peptide * hla`, `mut_hla * wt_hla`). In `forward`, that HLA-conditioned competition state now modulates the existing `scalar_contrast_hidden` and `contrast_hidden` alongside the scalar inputs, keeping the change narrow and focused on scalar feature interpretation plus WT-vs-Mut contrast structure. Verification: `python -m py_compile train.py` passed.
neoantigen	constrained	1	49	c4a23f6											0.750054			0					discard				304.240778	14		Read `program.md` and `train.py`, then modified only `train.py`. Added `preference_contrast_conditioner`, a lightweight affine conditioner that consumes `binding_contrast_hidden` plus signed peptide-HLA competition `mut_hla - wt_hla`, and uses it to modulate the existing `preference_contrast_hidden` after `preference_contrast_head`. This keeps the edit narrow and representation-focused around the WT-vs-Mut contrast path plus HLA-conditioned interaction structure, while reusing the strongest prior signal from round 43 instead of adding a broader branch. Verification: `python -m py_compile train.py` passed.
neoantigen	constrained	1	50	aa13010											0.748236			0					discard				304.219401	26		Read `program.md` and `train.py`, then modified only `train.py`. Added `contrast_bridge_context`, a lightweight encoder over `preference_delta_hidden`, `preference_contrast_hidden`, and the existing round-43 `binding_contrast_hidden`, and injected that bridge state into both the main `contrast_head` and final fusion conditioning. This keeps the change narrow and focused on WT-vs-Mut contrast structure plus HLA-conditioned interaction structure, while reusing the strongest prior signal instead of changing losses or sampling. Verification: `python -m py_compile train.py` passed.
neoantigen	constrained	1	51	43e3ac4											0.625814			0					discard				303.615315	24		Read `program.md` and `train.py`, then modified only `train.py`. Added `hla_conditioned_scalar_context`, a lightweight encoder over comparison/context scalars, the existing `binding_contrast_hidden`, and signed peptide-HLA competition `mut_hla - wt_hla`; its hidden state is injected into the main `contrast_head` only. This keeps the change narrow and focused on scalar feature interpretation plus WT-vs-Mut contrast structure and HLA-conditioned interactions, while leaving objectives, pooling, sampling, and output-bias behavior unchanged. Verification: `python -m py_compile train.py` passed.
neoantigen	constrained	1	52	9424669											0.695918			0					discard				303.655642	38		Read `program.md` and `train.py`, then modified only `train.py`. Added `ordered_binding_preference_context`, a lightweight shared encoder over ordered mut/wt base binding scalars, their signed difference, shared peptide-HLA support `average_peptide * hla`, and signed HLA-conditioned advantage (`mut_hla - wt_hla` for mut, sign-flipped for wt). Its role-specific hidden state is appended to the mut-side and wt-side preference inputs before the shared allele-preference head, keeping the change narrow and focused on scalar feature blocks plus WT-vs-Mut contrast structure and HLA-conditioned interactions. Verification: `python -m py_compile train.py` passed.
neoantigen	constrained	1	53	850ef18											0.574899			0					discard				303.595955	40		Read `program.md` and `train.py`, then modified only `train.py`. Added a lightweight `scalar_hla_bridge` encoder that re-encodes comparison/context scalars together with the existing `binding_contrast_hidden`, signed peptide-HLA advantage, and shared peptide-HLA support. That bridge now feeds the existing `scalar_contrast_head` and `contrast_conditioner`, keeping the change narrow and focused on scalar feature interpretation plus WT-vs-Mut contrast structure and HLA-conditioned interactions. Verification: `python -m py_compile train.py` passed.
neoantigen	constrained	1	54	829d270											0.699519			0					discard				303.574856	19		Read `program.md` and `train.py`, then modified only `train.py`. Added a lightweight `preference_delta_refiner` that re-encodes `preference_delta_hidden` from four views: raw mut-vs-wt preference delta, mean mut/wt preference state, absolute preference separation, and existing `binding_contrast_hidden` when present. The refined delta is then used by the scalar contrast head and main contrast head, keeping the edit narrow and focused on scalar/WT-vs-Mut contrast structure plus HLA-conditioned interaction support. Verification: `python -m py_compile train.py` passed.
neoantigen	constrained	1	55	48dc423											0.710719			0					discard				303.595296	16		Read `program.md` and `train.py`, then modified only `train.py`. Added `preference_delta_refiner`, a lightweight encoder over the raw preference delta, mean mut/wt preference state, absolute preference separation, signed peptide-HLA advantage (`mut_hla - wt_hla`), shared peptide-HLA support (`average_peptide * hla`), and existing `binding_contrast_hidden` when available. The refined preference delta now feeds the existing scalar contrast and main WT-vs-Mut contrast path, keeping the change narrow and aligned with scalar/contrast/HLA-conditioned priorities. Verification: `python -m py_compile train.py` passed.
neoantigen	constrained	1	56	2e1095c											0.666019			0					discard				303.712583	26		Read `program.md` and `train.py`, then modified only `train.py`. Added a new default scalar block, `priority`, with six higher-level features: mutant EL crossed with stability, foreignness, and agretopicity, plus mutant-over-wildtype EL advantage crossed with those same signals. Routed that block into the existing selected scalar matrix and widened the existing scalar contrast / contrast-conditioning path from `comparison/context` to `comparison/context/priority`, keeping the change narrow and representation-focused. Verification: `python -m py_compile train.py` passed.
neoantigen	constrained	1	57	48739cc											0.650022			0					discard				303.740180	47		Read `program.md` and `train.py`, then modified only `train.py`. Added `preference_support_context`, a lightweight encoder over mean mut/wt preference state, absolute preference separation, existing `binding_contrast_hidden`, and shared peptide-HLA support (`average_peptide * hla`). Its hidden state is appended to the existing `preference_contrast_head` inputs and also passed into the main `contrast_head`, keeping the change narrow and focused on WT-vs-Mut contrast structure plus HLA-conditioned interaction support. Verification: `python -m py_compile train.py` passed.
neoantigen	constrained	1	58	a60fc4b											0.488646			0					discard				303.665111	21		Read `program.md` and `train.py`, then modified only `train.py`. Added `preference_contrast_conditioner`, a lightweight affine conditioner over the selected comparison/context scalar block, signed peptide-HLA advantage, and existing `binding_contrast_hidden` when available; it modulates the existing `preference_contrast_hidden` immediately after `preference_contrast_head`. This keeps the change small and focused on scalar feature interpretation plus the explicit WT-vs-Mut contrast path with HLA-conditioned interaction support. Verification: `python -m py_compile train.py` passed.
neoantigen	constrained	1	59	9bcca07											0.669905			0					discard				303.592163	26		Read `program.md` and `train.py`, then modified only `train.py`. Added a new default scalar block, `competition`, with five higher-level absolute mut/wt regime features: `mean_log_ba`, `mean_el_score`, `abs_log_ba_gap`, `abs_el_gap`, and `stability_x_mean_el`. Routed that block into the existing selected scalar matrix and widened only the existing scalar contrast / contrast-conditioning path from `comparison/context` to `comparison/context/competition`, keeping the edit narrow and representation-focused. Verification: `python -m py_compile train.py` passed.
neoantigen	constrained	1	60	a8e16da											0.751128			0					discard				303.721570	27		Read `program.md` and `train.py`, then modified only `train.py`. Added a new default scalar block, `support`, with five higher-level WT-vs-Mut advantage-in-context features: `mean_el_x_el_advantage`, `mean_log_ba_x_ba_advantage`, `foreignness_x_el_advantage`, `stability_x_ba_advantage`, and `agretopicity_x_mean_el`. Routed that block into the selected scalar matrix and widened the existing scalar contrast / contrast-conditioning path from `comparison/context` to `comparison/context/support`, keeping the change narrow and representation-focused. Verification: `python -m py_compile train.py` passed.
neoantigen	constrained	1	61	50b7e4e											0.672774			0					discard				303.798007	27		Read `program.md` and `train.py`, then modified only `train.py`. Added a new default scalar block, `consensus`, with five higher-level features built from BA/EL agreement: raw BA-by-EL advantage agreement, plus stability-, foreignness-, mean-EL-, and agretopicity-weighted versions of that consensus signal. Routed that block into the selected scalar matrix and widened the existing scalar contrast / contrast-conditioning path from `comparison/context` to `comparison/context/consensus`, keeping the change narrow and representation-focused. Verification: `python -m py_compile train.py` passed.
neoantigen	constrained	1	62	bb57457											0.704998			0					discard				303.822422	25		Read `program.md` and `train.py`, then modified only `train.py`. Added a new default scalar block, `escape`, with five higher-level features: `mut_el_x_ba_escape`, `mut_el_x_el_escape`, `stability_x_ba_escape`, `foreignness_x_el_escape`, and `agretopicity_x_ba_escape`, where BA escape is `wt_log_ba - mut_log_ba` and EL escape is `mut_el - wt_el`. Routed that block into the selected scalar matrix and widened the existing scalar contrast / contrast-conditioning path from `comparison/context` to `comparison/context/escape`, keeping the change narrow and aligned with scalar WT-vs-Mut contrast priorities. Verification: `python -m py_compile train.py` passed.
neoantigen	constrained	1	63	96b37d0											0.746283			0					discard				303.675958	29		Read `program.md` and `train.py`, then modified only `train.py`. Added `contrast_consensus_head`, a lightweight encoder over `preference_contrast_hidden`, `scalar_contrast_hidden`, their elementwise product, their absolute difference, and existing `binding_contrast_hidden` when present. The resulting consensus hidden state now feeds the main `contrast_head` and final fusion conditioning, keeping the change narrow and focused on WT-vs-Mut contrast structure plus HLA-conditioned interaction support. Verification: `python -m py_compile train.py` passed.
neoantigen	constrained	1	64	3bf5a04											0.758909			0					discard				303.587005	27		Read `program.md` and `train.py`, then modified only `train.py`. Added a new default scalar block, `shared`, with five features: `shared_el_support`, `shared_ba_support`, `shared_el_x_el_advantage`, `shared_ba_x_ba_advantage`, and `agretopicity_x_shared_el`. Routed that block into the selected scalar matrix and widened the existing scalar contrast / contrast-conditioning path from `comparison/context` to `comparison/context/shared`, keeping the change narrow and representation-focused. Verification: `python -m py_compile train.py` passed.
neoantigen	constrained	1	65	edff4dc											0.768244			0					discard				303.585923	21		Read `program.md` and `train.py`, then modified only `train.py`. Added `hla_interaction_context`, a lightweight encoder over shared peptide-HLA support (`average_peptide * hla`), signed peptide-HLA advantage (`mut_hla - wt_hla`), peptide-HLA difference magnitude (`abs(mut_hla - wt_hla)`), and the existing `preference_delta_hidden`. The resulting hidden state now feeds both `preference_contrast_head` and the main `contrast_head`, keeping the edit narrow and focused on explicit WT-vs-Mut contrast structure plus HLA-conditioned interaction support. Verification: `python -m py_compile train.py` passed.
